{
  "ReplicationInstanceIdentifier": "example-6832",
  "ReplicationInstanceClass": "example-3735",
  "ReplicationInstanceStatus": "example-1158",
  "AllocatedStorage": "example-5735",
  "InstanceCreateTime": "example-4153",
  "VpcSecurityGroups": "example-9211",
  "AvailabilityZone": "example-7774",
  "ReplicationSubnetGroup": "example-9037",
  "PreferredMaintenanceWindow": "example-5161",
  "PendingModifiedValues": "example-9976",
  "MultiAZ": "example-2566",
  "EngineVersion": "example-8479",
  "AutoMinorVersionUpgrade": "example-8096",
  "KmsKeyId": "example-3256",
  "ReplicationInstanceArn": "example-2166",
  "ReplicationInstancePublicIpAddress": "example-6771",
  "ReplicationInstancePrivateIpAddress": "example-5710",
  "ReplicationInstancePublicIpAddresses": "example-4482",
  "ReplicationInstancePrivateIpAddresses": "example-1414",
  "ReplicationInstanceIpv6Addresses": "example-6852",
  "PubliclyAccessible": "example-2580",
  "SecondaryAvailabilityZone": "example-3601",
  "FreeUntil": "example-4991",
  "DnsNameServers": "example-4837",
  "NetworkType": "example-2658"
}